{
  "input_txt": "./assets/example-novel.txt",
  "output_dir": "./workspace/example-run",
  "title": "傲世无双",
  "author": "少年小蜗",
  "tags": "玄幻/穿越/多女主",
  "target_defense": "布甲",
  "batch_size": 80,
  "overlap": 2,
  "enrich_mode": "fallback",
  "enricher_cmd": "",
  "pipeline_mode": "performance",
  "sample_mode": "fixed",
  "sample_count": 7,
  "sample_level": "auto",
  "sample_min_count": 0,
  "sample_max_count": 0,
  "sample_strategy": "risk-aware",
  "wiki_dict": "",
  "report_default_view": "newbie",
  "report_pdf": false,
  "report_pdf_output": "./workspace/example-run/merged-report.pdf",
  "report_pdf_engine_cmd": "",
  "report_relation_graph": true,
  "report_relation_graph_output": "./workspace/example-run/relation-graph.html",
  "report_relation_top_chars": 20,
  "report_relation_top_signals": 16,
  "report_relation_min_edge_weight": 2,
  "report_relation_max_links": 220,
  "report_relation_min_name_freq": 2,
  "db_mode": "local",
  "db_path": "./scan-db",
  "db_ingest_cmd": ""
}
